{
  "basada_en": "completo",
  "enfoque": "opinión",
  "entidades": [
    "Google",
    "AI Overviews",
    "ChatGPT",
    "MCP",
    "A2A",
    "ARD",
    "OKF"
  ],
  "fecha": "2026-06-28",
  "huella": "b4875ca1614d6bb95b338131de55827fc36c63e0f17748dbbb0f2f47b0d345be",
  "id": "202934827",
  "metricas_publicas": {
    "comentarios": 2,
    "reacciones": 6,
    "restacks": 1
  },
  "nivel": "avanzado",
  "subtemas": [
    "web agent-to-agent",
    "capa de cambios",
    "protocolos para agentes",
    "arquitectura de información",
    "reducción de ambigüedad"
  ],
  "tema": "SEO y visibilidad con IA",
  "tesis": "El futuro del SEO no es solo salir citado en ChatGPT: la frontera se mueve hacia capas de contexto, cambios, entidades y confianza legibles por agentes, hacia una web que pueda explicarse a sí misma.",
  "titulo": "El futuro del SEO no es \"solo\" salir en ChatGPT",
  "url": "https://ainalluna.substack.com/p/agent-to-agent-seo"
}
