{
  "basada_en": "completo",
  "enfoque": "tutorial con prueba propia",
  "entidades": [
    "Google",
    "AI Overviews",
    "Google Search Console",
    "Semrush",
    "Google Sheets",
    "Claude Code",
    "Chrome",
    "ChatGPT"
  ],
  "fecha": "2026-03-02",
  "huella": "15eac8b8f0480b5ff7a09e013f8bc48c8cbacde5eb0c20ad62db9c3c02c73273",
  "id": "189540705",
  "metricas_publicas": {
    "comentarios": 6,
    "reacciones": 9,
    "restacks": 2
  },
  "nivel": "intermedio",
  "subtemas": [
    "auditoría de citas en AI Overviews",
    "extensión de Chrome propia",
    "análisis de fuentes citadas por Google",
    "estrategia de contenido para ser citado"
  ],
  "tema": "SEO y visibilidad con IA",
  "tesis": "El objetivo SEO ya no es ser el primer resultado sino la fuente citada por AI Overviews, y puedes auditar esa visibilidad gratis con una extensión propia en vez de pagar otra herramienta.",
  "titulo": "¿Cómo auditar tu visibilidad en Google AI Overviews?",
  "url": "https://ainalluna.substack.com/p/como-auditar-tu-visibilidad-en-google"
}
