{
  "basada_en": "completo",
  "enfoque": "opinión",
  "entidades": [
    "Archigram",
    "Plug-in City",
    "Richard Rumelt",
    "Good Strategy Bad Strategy"
  ],
  "fecha": "2025-11-16",
  "huella": "4ca80696ef932d7f96813f4a3a4927b7084765cc7b4328a96d6ec9bb1788bd3e",
  "id": "178477997",
  "metricas_publicas": {
    "comentarios": 0,
    "reacciones": 5,
    "restacks": 1
  },
  "nivel": "inicial",
  "subtemas": [
    "infraestructura compartida vs pilotos aislados",
    "diagnóstico de problemas críticos",
    "silos de conocimiento",
    "modularidad"
  ],
  "tema": "Estrategia de IA",
  "tesis": "Acumular casos de uso de IA sin una infraestructura de conocimiento compartida no es estrategia: es construir un museo de prototipos que nunca escalará.",
  "titulo": "#6 ¿Estás construyendo una ciudad o un museo? ",
  "url": "https://ainalluna.substack.com/p/6-estas-construyendo-una-ciudad-o"
}
