{
  "basada_en": "completo",
  "enfoque": "tutorial con prueba propia",
  "entidades": [
    "Netflix",
    "Gemini",
    "Gems de Gemini",
    "YouTube",
    "Nano Banana"
  ],
  "fecha": "2026-03-09",
  "huella": "fdcf5b9d6757ff490e4039b9a707d4de848777c078f60190111caa552771042a",
  "id": "190295495",
  "metricas_publicas": {
    "comentarios": 7,
    "reacciones": 21,
    "restacks": 5
  },
  "nivel": "inicial",
  "subtemas": [
    "miniaturas de YouTube",
    "CTR",
    "convertir artículos técnicos en asistentes",
    "Gems de Gemini"
  ],
  "tema": "Contenido y curación con IA",
  "tesis": "El verdadero hack no es generar desde cero con IA, sino coger conocimiento público de calidad, como la investigación de CTR de Netflix, y convertirlo en una herramienta aplicable.",
  "titulo": "Netflix publicó sus secretos de CTR. Yo los convertí en un asistente de miniaturas.",
  "url": "https://ainalluna.substack.com/p/netflix-publico-sus-secretos-de-ctr"
}
