{
  "basada_en": "completo",
  "enfoque": "caso",
  "entidades": [
    "Claude Code",
    "Growth Editor",
    "Substack",
    "Think&Hack"
  ],
  "fecha": "2026-04-13",
  "huella": "28d083e60ee37b63835ec492a9ea4a7517d61cc8ae6ee36633060c10ad15c02e",
  "id": "193981605",
  "metricas_publicas": {
    "comentarios": 4,
    "reacciones": 9,
    "restacks": 3
  },
  "nivel": "intermedio",
  "subtemas": [
    "growth editor",
    "métricas de contenido",
    "lecciones a partir de datos propios",
    "bucle de aprendizaje"
  ],
  "tema": "Escribir con IA",
  "tesis": "La IA te hace producir más rápido pero no mejor: solo mejora el contenido si cierras el bucle con un growth editor que convierte tus métricas reales en restricciones que el sistema carga antes de escribir.",
  "titulo": "Tu IA produce más, no mejor: Cómo mejorar tu contenido creado con IA",
  "url": "https://ainalluna.substack.com/p/mejorar-newsletter-ia"
}
