{
  "basada_en": "completo",
  "enfoque": "tutorial con prueba propia",
  "entidades": [
    "Claude Code",
    "Anthropic"
  ],
  "fecha": "2026-07-12",
  "huella": "3b1e4d7ccee8568836b5aba9b592713fbd164c47c54815a9498968ef7b3eb911",
  "id": "206658860",
  "metricas_publicas": {
    "comentarios": 4,
    "reacciones": 9,
    "restacks": 8
  },
  "nivel": "intermedio",
  "subtemas": [
    "subagentes puntuales vs custom agents",
    "agent teams y cuándo evitarlos",
    "limitar herramientas y permisos",
    "probar los límites de un agente",
    "niveles de delegación"
  ],
  "tema": "Agentes de IA",
  "tesis": "No elijas entre un agente y un sistema multiagente por lo impresionante que parece: aumenta la delegación solo cuando el trabajo lo justifica, porque dividir sin necesidad solo reparte la ambigüedad.",
  "titulo": "Un agente, un subagente o un equipo: ¿qué necesitas realmente?",
  "url": "https://ainalluna.substack.com/p/crear-agentes-claude-code"
}
