{
  "basada_en": "completo",
  "enfoque": "explicación",
  "entidades": [
    "ChatGPT",
    "Gemini",
    "Claude",
    "GPTs",
    "Gems",
    "ChatGPT Projects"
  ],
  "fecha": "2026-01-07",
  "huella": "6b07f44265087263c3340f71b8405d3668af5a0940cd683f0a43b7411511197a",
  "id": "183644091",
  "metricas_publicas": {
    "comentarios": 0,
    "reacciones": 7,
    "restacks": 3
  },
  "nivel": "inicial",
  "subtemas": [
    "arquitectura de memoria por plataforma",
    "GPTs personalizados sin memoria",
    "proyectos como alternativa",
    "continuidad entre chats"
  ],
  "tema": "Memoria y contexto",
  "tesis": "Mucha gente monta asistentes personalizados sin entender la arquitectura de memoria que hay debajo: la pregunta no es cómo configurar el GPT perfecto, sino qué arquitectura de memoria necesita lo que quieres hacer.",
  "titulo": "#14 Memoria en ChatGPT, Gemini y Claude: Cómo funciona realmente ",
  "url": "https://ainalluna.substack.com/p/gestion-memorias-llm"
}
