{
  "basada_en": "completo",
  "enfoque": "tutorial con prueba propia",
  "entidades": [
    "ChatGPT",
    "ChatGPT Work",
    "GPTs",
    "OpenAI"
  ],
  "fecha": "2026-10-04",
  "huella": "6255f1771e366f4057e6cd6dba264807ac0fc3cd353f764f65cd0e4d8248eb5a",
  "id": "217631531",
  "metricas_publicas": {
    "comentarios": 0,
    "reacciones": 6,
    "restacks": 2
  },
  "nivel": "inicial",
  "subtemas": [
    "convertir un tutorial ajeno en skill",
    "migración de GPTs personalizados",
    "diferencia entre skill y complemento",
    "revisar y editar las instrucciones guardadas"
  ],
  "tema": "Skills para agentes",
  "tesis": "Con la retirada de los GPT personalizados, el movimiento útil es convertir los tutoriales que tienes guardados en skills de ChatGPT Work: guardas el procedimiento y lo reutilizas sin reexplicar el material cada vez.",
  "titulo": "Adiós a los GPT personalizados. Hola, skills.",
  "url": "https://ainalluna.substack.com/p/como-crear-skill-chatgpt-work"
}
