{
  "basada_en": "completo",
  "enfoque": "opinión",
  "entidades": [
    "NotebookLM",
    "Google",
    "ChatGPT",
    "Claude",
    "John Searle"
  ],
  "fecha": "2025-10-19",
  "huella": "e6c0d12ee02c98753447212bba92ccf91d3b9560c1cdf8800d112cc607c7e752",
  "id": "176474189",
  "metricas_publicas": {
    "comentarios": 2,
    "reacciones": 2,
    "restacks": 4
  },
  "nivel": "inicial",
  "subtemas": [
    "delegar la comprensión lectora",
    "prompts de recuperación verificable",
    "buscar contradicciones en vez de confirmaciones",
    "acumulación vs síntesis"
  ],
  "tema": "Pensamiento crítico con IA",
  "tesis": "NotebookLM es extraordinario recuperando información, pero si le delegas la comprensión te da precisión sin criterio: la inteligencia sigue estando en las preguntas que haces tú después.",
  "titulo": "2# NotebookLM lee por ti. Ese es el problema",
  "url": "https://ainalluna.substack.com/p/2-notebooklm-lee-por-ti-ese-es-el"
}
