{
  "basada_en": "completo",
  "enfoque": "tutorial con prueba propia",
  "entidades": [
    "Nano Banana Pro",
    "Gemini 3 Pro",
    "Google",
    "SynthID",
    "Think&Hack"
  ],
  "fecha": "2026-01-21",
  "huella": "1ff3dd705381ed39dce0db8c2c664df58a12ad249c046458160c33be339cbdbf",
  "id": "184848409",
  "metricas_publicas": {
    "comentarios": 0,
    "reacciones": 6,
    "restacks": 2
  },
  "nivel": "inicial",
  "subtemas": [
    "generación de imágenes",
    "patrón SCIER",
    "razonamiento antes de renderizar",
    "limitaciones de los modelos de imagen"
  ],
  "tema": "Prompting",
  "tesis": "Nano Banana Pro razona antes de renderizar, así que la diferencia entre un resultado pegote y uno integrado no es el modelo sino la estructura del prompt que le dice sobre qué razonar.",
  "titulo": "Think&Hack #18 — Lo que nadie explica de Nano Banana Pro",
  "url": "https://ainalluna.substack.com/p/nano-banana-pro-prompts"
}
