{
  "basada_en": "completo",
  "enfoque": "opinión",
  "entidades": [
    "Richard Rumelt",
    "NIST",
    "METR",
    "UNIR"
  ],
  "fecha": "2026-08-02",
  "huella": "8fcdec01ba08b3db278630e2d74cf293ef9275f21fa4fc2b13137b36717fad7d",
  "id": "209140975",
  "metricas_publicas": {
    "comentarios": 1,
    "reacciones": 7,
    "restacks": 1
  },
  "nivel": "intermedio",
  "subtemas": [
    "diseño de pilotos de IA",
    "diagnóstico antes de la solución",
    "hipótesis comprobables",
    "métricas y línea base",
    "criterios para escalar"
  ],
  "tema": "Estrategia de IA",
  "tesis": "Implantar agentes con una cifra prometida no es estrategia: un piloto de IA debe formularse como hipótesis comprobable, con línea base, umbrales de decisión fijados de antemano y evidencia de que mejora el proceso completo antes de escalar.",
  "titulo": "Cinco agentes no son una estrategia de IA",
  "url": "https://ainalluna.substack.com/p/piloto-ia-disenar-medir-escalar"
}
